{"schema_version":"2.0.0","election_year":2024,"election_type":"presidential","unit":"election_quality","source_id":"ine_counted_lists","rate_unit":"proportion","data":[{"election_year":2024,"available_segments":17735,"supported_segments":14190,"available_municipalities":2477,"supported_municipalities":2402,"supported_states":32,"LN":98330348,"SV":54899228,"NV":37105466,"NS":6325654,"source_row_count":9773730,"sex_2_source_rows":105,"sex_2_nominal_count":105,"supported_LN":98203780,"supported_nominal_fraction":0.9987128287189627,"supported_municipality_fraction":0.9697214372224465,"continuous_profiles":4954,"supported_continuous_profiles":4648,"continuous_municipalities":2341,"continuous_supported_LN":98153652,"continuous_nominal_fraction":0.9982030369708444,"continuous_complete_profiles":4930,"high_ns_segments":2782,"near_reference_supported_segments":1873,"near_reference_supported_fraction":0.13199436222692038,"undefined_segment_rates":137,"undefined_continuous_profiles":24,"supported_exact_tie_segments":0,"exact_tie_segments":0,"few_section_supported_segments":3921,"observed_distinct_sections":70751,"section_keys_in_multiple_municipalities":0,"over_100_source_rows":12891,"over_100_LN":13197,"profiles_with_support":6,"unspecified_rate":0.06433063778031173,"district_reference_year":2023}],"warnings":["Son segmentos agregados, no personas ni clases naturales descubiertas.","NS representa no especificación, no abstención. Las tasas no definidas son NULL.","Las claves territoriales se consultan dentro de cada elección; no hay equivalencias municipales históricas oficiales validadas.","U/R/M describe secciones electorales, no residencia individual ni localidad.","La lista nominal reportada procede de cuadernillos; no incluye casillas especiales ni voto del extranjero según el diccionario.","Los municipios pueden pertenecer a varios perfiles; su cobertura no se suma entre perfiles.","Los intervalos y el signo relativo son reglas explícitas. Una diferencia cercana a cero requiere cautela."]}